{
  "schema_name": "deckcompiler_run_manifest",
  "schema_version": "1.0.0",
  "artifact": {
    "artifact_id": "art_66666666666666666666",
    "artifact_type": "deckcompiler_run_manifest",
    "artifact_version": "1.0.0",
    "product": {
      "product_name": "PPTX Generator",
      "product_slug": "pptx-generator",
      "system_name": "DeckCompiler",
      "system_id": "deckcompiler",
      "reconstruction_engine": "PNGtoPPTX"
    },
    "provenance": {
      "created_at": "2026-07-15T21:00:05+09:00",
      "producer": {
        "tool_name": "deckcompiler-contract-fixture",
        "tool_version": "1.0.0",
        "runtime": "repository-authored-synthetic"
      },
      "build_baseline": "e0259b7551c381f8c0de4cdd329d5943680fa502",
      "source_commit": "39b4c104b23d4e09446388db2a8b2fb873a7824b",
      "input_artifact_ids": [
        "art_11111111111111111111",
        "art_22222222222222222222",
        "art_33333333333333333333",
        "art_44444444444444444444",
        "art_55555555555555555555"
      ]
    },
    "content_sha256": "6666666666666666666666666666666666666666666666666666666666666666"
  },
  "run_id": "run_aaaaaaaaaaaaaaaaaaaa",
  "started_at": "2026-07-15T21:00:00+09:00",
  "updated_at": "2026-07-15T21:00:05+09:00",
  "build_baseline": "e0259b7551c381f8c0de4cdd329d5943680fa502",
  "source_commit": "39b4c104b23d4e09446388db2a8b2fb873a7824b",
  "stage_status": {
    "source_contracts": "passed",
    "evidence_contracts": "passed",
    "blueprint_wrapper": "passed",
    "visual_target_boundary": "planned",
    "png_reconstruction_boundary": "planned"
  },
  "artifacts": [
    {
      "artifact_type": "source_corpus",
      "artifact_id": "art_11111111111111111111",
      "path": "source_corpus.json",
      "required": true
    },
    {
      "artifact_type": "evidence_unit_registry",
      "artifact_id": "art_22222222222222222222",
      "path": "evidence_unit_registry.json",
      "required": true
    },
    {
      "artifact_type": "slide_blueprint_collection",
      "artifact_id": "art_33333333333333333333",
      "path": "slide_blueprint_collection.json",
      "required": true
    },
    {
      "artifact_type": "visual_target_manifest",
      "artifact_id": "art_44444444444444444444",
      "path": "visual_target_manifest.json",
      "required": true
    },
    {
      "artifact_type": "png_reconstruction_manifest",
      "artifact_id": "art_55555555555555555555",
      "path": "png_reconstruction_manifest.json",
      "required": true
    }
  ],
  "retry_history": [],
  "warnings": [
    "Contract fixture only: no Image Generation or PNGtoPPTX execution occurred.",
    "Visual targets are offline locked-fixture records and are not release eligible."
  ],
  "errors": [],
  "validation_status": "valid"
}
